{
  "schema_version": "1.2",
  "site": "https://www.fastmail.com/",
  "audited_at": "2026-09-10T03:56:00Z",
  "executive_summary": {"conclusion": "The sampled Fastmail public pages clearly describe a privacy-focused email, calendar and contacts service, expose pricing and security/data-residency routes, and provide business/custom-domain context. No material discoverability, answerability or trust defect was directly observed in the bounded static and retrieval sample. Browser rendering and interactive journeys were unavailable in this session, so engagement completion and rendered/accessibility behavior remain untested.", "top_action_ids": []},
  "summary": {"total_findings": 0, "critical": 0, "high": 0, "medium": 0, "low": 0},
  "coverage": {"pages_checked": 12, "modes": ["static", "off_site", "retrieval"], "not_checked": ["Rendered browser journey was not available: no IAB browser surface was exposed after the prior GOV.UK case.", "Interactive CTA behavior, sign-up flow, keyboard/focus/mobile/performance checks were not measured.", "Actual assistant answers/citations, provider logs and analytics were not measured.", "No sign-up, form submission, account, personal data, message or purchase action was attempted."]},
  "findings": [],
  "proactive_opportunities": [],
  "assessment": {
    "mode": "agent_composed",
    "readiness": [
      {"stage": "access", "status": "observed", "detail": "Static collection retrieved the requested Fastmail origin and sampled pages without errors; crawler policy was recorded by the collector. This does not prove provider access.", "urls": ["https://www.fastmail.com/", "https://www.fastmail.com/robots.txt"]},
      {"stage": "extraction", "status": "observed", "detail": "Static HTML exposed service scope, trial CTA, pricing, security and residency language, business/custom-domain positioning, and policy dates.", "urls": ["https://www.fastmail.com/", "https://www.fastmail.com/pricing/", "https://www.fastmail.com/features/security/", "https://www.fastmail.com/business/"]},
      {"stage": "answerability", "status": "observed", "detail": "Three task-specific questions were answered by inspected first-party pages and a first-party help source.", "urls": ["https://www.fastmail.com/", "https://www.fastmail.com/pricing/", "https://www.fastmail.com/features/security/", "https://www.fastmail.help/hc/en-us/articles/16796454162063-Choosing-your-data-residency"]},
      {"stage": "corroboration", "status": "observed", "detail": "Bounded retrieval returned Fastmail pricing, custom-domain and residency help pages; the residency help page qualifies the EU choice with US replication, resolving a potentially material qualifier in-sample.", "urls": ["https://www.fastmail.help/hc/en-us/articles/16796454162063-Choosing-your-data-residency", "https://www.fastmail.help/hc/en-us/articles/360058753394-Custom-domains-with-Fastmail", "https://www.fastmail.com/pricing/us/"]},
      {"stage": "engagement", "status": "not_checked", "detail": "No browser surface was available for safe rendered journeys; static links establish routes but not successful interaction.", "urls": ["https://www.fastmail.com/", "https://www.fastmail.com/pricing/"]}
    ],
    "intent_tests": [
      {"question": "What does Fastmail offer and who is it for?", "required_elements": ["email service", "calendar and contacts", "individual or business audience"], "status": "answered", "evidence": [{"url": "https://www.fastmail.com/", "quote": "Fast, private email hosting for you or your business. Mail Contacts Calendar"}, {"url": "https://www.fastmail.com/business/", "quote": "For business"}], "reason": "The homepage and business page identify the offer and audiences."},
      {"question": "What plans or cost context is available?", "required_elements": ["pricing page", "plan families or supported offerings", "trial/no-card qualifier"], "status": "answered", "evidence": [{"url": "https://www.fastmail.com/", "quote": "Try free for 30 days ... No obligation, no credit card required."}, {"url": "https://www.fastmail.com/pricing/", "quote": "All plans include Email Calendar Contacts Files ... Individual & Family Business"}], "reason": "The inspected homepage and pricing page provide the trial qualifier and plan families; exact locale-dependent amounts were not frozen as a requirement."},
      {"question": "How does Fastmail address privacy and data residency?", "required_elements": ["encryption/security statement", "EU or USA choice", "replication qualifier"], "status": "answered", "evidence": [{"url": "https://www.fastmail.com/features/security/", "quote": "stored encrypted on disks inside locked racks in our data centers"}, {"url": "https://www.fastmail.com/", "quote": "Choose your primary data residency: EU or USA."}, {"url": "https://www.fastmail.help/hc/en-us/articles/16796454162063-Choosing-your-data-residency", "quote": "if you choose the EU region ... a live copy of your data is still replicated to the US."}], "reason": "Security, residency choice and the material replication qualifier are all supported by opened first-party sources."},
      {"question": "Can a business use a custom domain?", "required_elements": ["custom-domain support", "business context", "public guidance route"], "status": "answered", "evidence": [{"url": "https://www.fastmail.com/business/", "quote": "Give everyone in your organization a professional email address at your domain."}, {"url": "https://www.fastmail.help/hc/en-us/articles/360058753394-Custom-domains-with-Fastmail", "quote": "A custom domain allows you to receive email at any address you like"}], "reason": "Business positioning and a dedicated custom-domain help page answer the test."}
    ],
    "journeys": [
      {"task": "Understand the product and reach pricing", "starting_context": "Visitor lands on the public Fastmail homepage seeking a private email/calendar service.", "steps": [{"url": "https://www.fastmail.com/", "action": "Static inspection of offer and primary CTA labels", "observation": "Homepage states email/calendar/contacts scope and exposes a 30-day trial and business route."}, {"url": "https://www.fastmail.com/pricing/", "action": "Inspect pricing destination from sampled site inventory", "observation": "Pricing page states included products and Individual/Family/Business plan families."}], "status": "not_checked", "reason": "A browser was unavailable, so link activation and rendered completion could not be observed."},
      {"task": "Evaluate a privacy-sensitive EU residency choice and custom-domain suitability", "starting_context": "Visitor needs residency context and business custom-domain support before considering a plan.", "steps": [{"url": "https://www.fastmail.com/features/security/", "action": "Inspect security/residency information route", "observation": "Security page states encryption at rest/in transit and presents EU/USA residency choice language."}, {"url": "https://www.fastmail.help/hc/en-us/articles/16796454162063-Choosing-your-data-residency", "action": "Inspect residency qualifier from retrieval", "observation": "Help page states EU-region data has a live copy replicated to the US."}, {"url": "https://www.fastmail.help/hc/en-us/articles/360058753394-Custom-domains-with-Fastmail", "action": "Inspect custom-domain guidance", "observation": "Help page explains receiving mail at a custom domain."}], "status": "not_checked", "reason": "These are static/retrieval observations only; no browser choice or handoff was exercised."}
    ],
    "visibility": {"status": "not_measured", "detail": "No unbiased actual assistant answer runs were recorded; retrieval results are not assistant-citation measurements.", "cohorts": []}
  }
}
